{
  "chartType": "composed_time",
  "xDimension": {
    "id": "time",
    "type": "time",
    "bucket": "5_MIN",
    "timezone": "UTC"
  },
  "series": [
    {
      "id": "occupancy",
      "label": "Occupancy",
      "axis": "Y1",
      "unit": "people",
      "geometry": "area",
      "data": [
        { "x": "2024-01-01T09:00:00Z", "y": 1, "coverage": 1.0 },
        { "x": "2024-01-01T09:05:00Z", "y": 2, "coverage": 1.0 },
        { "x": "2024-01-01T09:10:00Z", "y": 1, "coverage": 1.0 }
      ],
      "summary": {
        "max": 2,
        "end": 1
      }
    },
    {
      "id": "throughput",
      "label": "Throughput",
      "axis": "Y2",
      "unit": "events/min",
      "geometry": "line",
      "data": [
        { "x": "2024-01-01T09:00:00Z", "y": 0.6 },
        { "x": "2024-01-01T09:05:00Z", "y": 0.8 },
        { "x": "2024-01-01T09:10:00Z", "y": 0.2 }
      ]
    },
    {
      "id": "entrances",
      "label": "Entrances",
      "axis": "Y3",
      "unit": "events",
      "geometry": "column",
      "stack": "flow",
      "data": [
        { "x": "2024-01-01T09:00:00Z", "y": 1 },
        { "x": "2024-01-01T09:05:00Z", "y": 1 },
        { "x": "2024-01-01T09:10:00Z", "y": 0 }
      ]
    },
    {
      "id": "exits",
      "label": "Exits",
      "axis": "Y3",
      "unit": "events",
      "geometry": "column",
      "stack": "flow",
      "data": [
        { "x": "2024-01-01T09:00:00Z", "y": 0 },
        { "x": "2024-01-01T09:05:00Z", "y": 0 },
        { "x": "2024-01-01T09:10:00Z", "y": 1 }
      ]
    }
  ],
  "meta": {
    "bucketMinutes": 5,
    "timezone": "UTC",
    "coverage": [
      { "x": "2024-01-01T09:00:00Z", "value": 1.0 },
      { "x": "2024-01-01T09:05:00Z", "value": 1.0 },
      { "x": "2024-01-01T09:10:00Z", "value": 1.0 }
    ],
    "surges": [],
    "summary": {
      "occupancy_max": 2,
      "occupancy_end": 1
    }
  }
}
